Nom;Programmes;Nom initial;Porteurs d'aides;Instructeurs;Bénéficiaires de l'aide;Types d'aide;Taux de subvention, min. et max. (en %, nombre entier);Taux de subvention (commentaire optionnel);Appel à projet / Manifestation d'intérêt;Description complète de l'aide et de ses objectifs;Exemples de projets réalisables;Sous-thématiques;Récurrence;Date d'ouverture;Date de clôture;Éligibilité;État d'avancement du projet pour bénéficier du dispositif;Types de dépenses / actions couvertes;Périmètre;URL d'origine;Lien vers une démarche en ligne;Contact;Auteur;Url d'origine de la donnée importée;Identifiant structure;Projets référents
Prime à la conversion;Action cœur de ville, 🇪🇺AGRIP - Promotion des produits agricoles;Prime à la conversion;22, 347;22, 347;Commune, Intercommunalité / Pays;Subvention, Prêt;10,22;Commentaire subvention;oui;"Description complète de l'aide

Et de ses objectifs";"Exemples
De projets réalisables";Equipement public, Eau potable;Ponctuelle;04/07/24;04/10/24;"Conditions 
D'élibigilités";Réflexion / conception, Mise en œuvre / réalisation, Usage / valorisation;Dépenses de fonctionnement, Dépenses d’investissement;71016;https://aides-territoires.beta.gouv.fr/;https://aides-territoires.beta.gouv.fr/;"Procédure de contact

Et emails à contacter";aides-territoires@beta.gouv.fr;https://aides-territoires.beta.gouv.fr/;4;Acquisition de véhicule décarboné, Construction d’une école
